key,title,description,sortOrder
faster-onboarding,Faster onboarding,Dummy benefit copy that explains the expected business value in a short paragraph.,0
cleaner-handoffs,Cleaner handoffs,Dummy benefit copy that keeps the card balanced while matching the surrounding plan.,1
less-manual-work,Less manual work,Dummy benefit copy for a workflow improvement that will be replaced with real content.,2
earlier-risk-signals,Earlier risk signals,Dummy benefit copy describing a useful customer insight surfaced at the right moment.,3
better-follow-up,Better follow-up,Dummy benefit copy that describes a more consistent rhythm across the account team.,4
clearer-reporting,Clearer reporting,"Dummy benefit copy for shared visibility into progress, next steps, and outcomes.",5
